comentario,etiqueta
vot ser conscient fanat odi decid mejor opcin present hij famili devuelv dignid libert trabaj salud educacin oportun emprend proyect empresarial famili necesit vot hombr emprendedor confiabl dign honr mient enga sab hac renac pas graci correism hoy destru vot lassopresidente2021 unic mejor opcin,1
vam president junt pod buen ms,1
nunc tendr vot uan person cpon pensamient retrogr educ criteri l oqu ir univers quemarc pesat aos titul merec jam tendr usted vot,-1
dios bendig sr president,1
cambi lleg guillerm lass dar propuest oportun gener emple moment necesit ecuatorian,1
vot mejor pas,1
lass lucion lass lucion lass lucion guillerm guillerm quer gobiern dil si oportun ser libr progres dil pretend convert venezuel pobr miser president lass lucion lass lucion lass lucion,1
lass president,1
suert doming,0
medi digital independient present viv ecuador,0
siempr pens dios quer lass inici victori lass president,1
vam lass president unid luch cambi logro morons santiag,1
arauz president,0
vam defend democraci social madur orteg corre quier eterniz gobiern oprim puebl saqu arcas fiscal lass president honest respet regresarn vam ecuador,1
yaku perez,0
pued,0
ecuador q merec asi,0
vam don guillerm,1
pvto lea,0
junt patri libr just democrat encontrmon guillerm lass president,1
seor lass dar vot primer vez usted ser nuev president dios conced lass president,1
alegr laz tig viv laz vuelv confi pod regres pas ador espa 23 aos eid ver hij padr famili trabaj dar hij padr com famili 23 aos aqu espa famili lind ecuador dese corazn gan piens pas tod jent pobr fuist lebant pas trabaj buen luch sac flot bell ecuador vuelv confi quier regres aor raz ecuador viv ecuador viv lass president,1
distanci lad continent lej amad ecuador conf usted famili dndol vot trabaj pais,1
vam guillerm,1
cuent conmig presi 11 abril vam cambi guillerm lass president,1
dios ilumin ecuatorian elij mejor,0
sro lass dar vot utd hech primer vez candidat sol pid import catlic creyent padr dios consagr corazn jess ecuador as mejor corazn jess salv salv ecuador,1
sr guillerm lass fe usted defraud quer trabaj mujer mayor 50 aos nadi contrat ayuden algun decret limit edad dios bendig famili vot 21 cre mus,1
bast mentir segu saqu pobr pas lass president,0
lass president ecuador gran pais dios bendig,0
confianz apoy logr cumpl objet lass president,1
dios bendig ecuador dios bendig guillerm lass junt pod alcanz victori urnas exit president,1
s pued ser president pas si pued cre,1
jams nunc ser president lass vot 1 tod 1,-1
vam x cambi lass president,1
segur vot famili sr lass,1
junt logr dec vot x guillerm lass,0
sr lass segur triunf ello triunf pais,1
gent sol voy dec convenc algui vot establec arauz hac cambi decisin impos mas aun si conoc pod cambi gent alrededor familiar amig deb hac seman unas eleccion clav jueg democraci represent mejor opcin guillerm lass,0
vot corazn guillerm lass president logr si cre,1
sr guillerm lass ustd president necesit ecuatorian dios bendig bendig hermos pais,0
andres mient vez,0
siempr adel senor president lass desdemon rom apoy incondicional,1
vam guillerm,1
delass quegan,0
lass caraj,0
excelent clip guillerm lass sig difundindol ltim,1
va gan encuest lass titer comfirm xfa,0
cad vez ms person unen encuentr vez gan,0
si vot arauz ecuador seguir econtr mejor si vot lass econtr cer mejor pas lass president salud quit,0
teamlass,0
lass president dios bendig 11 abril vot acab social ecuador libr permit flaud cmo pas 2017,1
ta bien,0
lassopresident,0
logr,0
vam lass usted president ecuador nesecit ser escuch vam logr,1
futur m pais lass president,1
si apoy las,1
dal lass usted gan ao,1
despus ven mar lourd,0
lass mentir quiz ser destitu ser descubiert negoci mafi albanes junt polici corrupt prinipi insegur,-1
hombr precav much luz,1
si m toc eleg president elij usted x q dos aos nadi pued hac maravill usted resolvi pas gobiern m explic 4 aos president usted va hac sol falt tiemp apoll d atras pais,1
lass culpabl pas ecuador diabl estan 2 millon emple,-1
ahi si dic rob plat puebl ecuatorian,-1
corrupt lass mayor ecuatorian estn gobiern corrupt,-1
president lad aprend bukel mejor president mund aprend,0
gring quier ten coloni tip president q mier,0
rat descar,-1
rat feri 99,-1
rafael corre regres puebl ecuatorian reclam retorn,0
dictadur ejecut,-1
felicit sr president disolucin asamble mejor rest tiemp qued pued ten tranquil gobern inici hic vid impos graci clar explicacin dios bendig,1
antipatriot guillerm lass qued libert,-1
macabr plan tom constitu repar dao caus president llev puebl asesinat pod subsist llev puebl preci com dar vid dign puebl necesit reparacin tod est gestin president turn antigu necesit reparacin malv president vieron patri slo bolsill mied pag mal gestin gobiern cumpl jurament nic hombr pued hac pag atropell ex president habl si sentenci ex president influj psquic peor president deber ser sentenci llev patri asesin mendig pobrez extrem sern sentenci caden perpetu mied ms van dec import sentenci import diner gan ser president anti patri,-1
hiz bien president buchel buchel qu qued salvador ecuatorian,1
plan macabr cre usted mism don lass justifiqu psim gobiern,-1
incnpetent alucin fuer incpaz incompetent carcel trafic sol tap ded,-1
lass chorr,-1
exelent respuest president guillerm laz ten hac bien nacin,1
correct president guillerm lass ecuatorian soport irrespet violacin deb proces juici poltic fundament glori dios,1
president est actu bien pon man dur comun pais estn pag madur castr cub cabez serpient hazt cort mund est peligr comun,1
hipocres derech si president oea grit dictadur,-1
president per realment si total bloqu parlamentari ten ningun acusacin corrupt hab permit hac anunci disolucin cmar inmediat medi acus dictador fuerz armad levant dan golp si embarg derech hac mism jug respald mism armad pod justific,-1
chayoter abund trist ver pobr gobern corrupt causant pobrez,-1
sabi prudent dios bendig,1
ten car dur mejor buen taj paras fiscal,-1
perd president,-1
manoton ahog tub lass permit muert crus debi sused conmocion intern debi llev juici poltic macabr hac pas pued ten segur incapac fracas total cunt tiemp emos perd,-1
period entiend dic,0
dign elogi agradec president guillerm lass sig derog tod ley cre pervers corre sig sig adel seor president lass,-1
mied mand sac,-1
plan macabr muec chuqui,-1
lass incompetent,-1
convien porq juici qued disuelt list eee,-1
bien,1
usted pued lass ultim bastin amric graci,1
vay dig ms mentir culp siempr,1
lass pandor papers quier cambi bien puebl cambi per si pdte fiscali contralor defensor puebl ahor quier jur nacional eleccion prens tradicional bien pag x silenci,-1
president sabi conocedor ley pas,1
orar amad pais tant mald exist ciert grup person empe hac,0
mexic chil puebl sab pod eleg congres dej corrupcion despiert puebl,0
cnn dndol espaci golpist,-1
period entendi,0
lass pud compr asamble pues sr nefast cad ves destru pas,-1
impud tip,-1
peor president histori ecuador banquer corrupt sum pobrez violenci,-1
ecuatorian admir president sol falt despiert pong man dur hamp,1
si tan sol sicari x tumb padr q tir bal demoni,-1
bien president quier daar nacin herman daad nacion ka repblic herman peru,1
mas mentir cruel president q pais motiv x deberi pon fot carondelet,-1
cinic,-1
si lass razon period gust ide elle ser correist,1
macabr t,-1
bendicion nombr jess seor president dios acompa siempr,1
sid ms mentir pinoch,-1
jaj president ser record ms int histori ecuador muert espald,-1
evit ir prisin sab ven est aleg pretext,-1
disolv culpabl sab qued mejor hic irs pen glori termin siend peor president moren demasi,-1
graci president pon pech bal usted mejor pas pas sig adel dios bendig cuid protej much sabidur segu adel,1
mejor obra guillerm lass disolucin asamble mand vag cas felicit seor president dios bendig,1
pobr individu slo hac cos mejor corre tare qued grand slo benefici amig due diner ecuador lleg hor banquer bachill zapat roj,-1
corre est detrs dej gobern uste apoy delicuent,0
corrupt,-1
crcel esper,-1
felicit president lass sac pesadill ciudadan veam maner iba aser justici dic dich bien vuelv men da vam tranquil ojal vez sep eleg comenz cer,-1
peor dan micrfon ste tip pas libr garr,-1
ideal seri vay evasor mintoman ladron,-1
mam mentir,-1
laz loc sufr deliri prosecucin lstim ecuador llen recurs sal adel soport gent laz,-1
guillerm lass banquer est prepar dirig pais,-1
derech liberal nic camin si ecuador sig vot candidat izquierd progres vam hund,0
llen boc mentir,-1
apoy president luch jorn hac president capac honest arrepient dios li bendig contin dndol sabidur mal corrupt quier va pod agarr pod abraz,1
saqu participacin ciudadan puebl pid seor president,0
apoy respet president laz ecuador hiz correct,1
bien hech viejit si hac mor pie,1
pais gobern merec,0
igual asamble sol dedic boicot pas cobr bien,0
qued sal sr las,0
si plan usted vay cas ms rpid posibl usted slo est enriquec ms ric ms pobr pobr lass,-1
rein espa pag dao hiz amric,0
seor lass si seor tter igual seor lenin moren,-1
amen amen amen,1
apoy mayor ecuador habl corrupcin usted deb explic diner escond pandor papers macabr coogobiern lenin moren peor gobi ecuador moren lass,-1
club miami unas mans palom entrevist corrupt derech latinoamer,0
vam autoritar pued soport respons,-1
lass sol destru ecuador merluz,-1
gan respet president lass,1
apoy president lass hor pong sinton ecuatorian demor ms val tard q nunc,1
graci lass,1
lass mient total acudi muert cruz alcanz vot compr asabl irrespons pens pas salv destitu lass vio perd actu maner,-1
debi hac castill per libr gent malv sol sab saqu odi peruan,0
felisid sr president,1
reporter peligr quis met president ganch qu l president evadi call,0
pobr panch est perd,0
investig profund encontr man madur tod componend,0
excelent accin president lass corre sac nacional punt,1
si verd hab plan macabr mism salv ir pres disolv congres parec golp buen golp mal buen hac president estan oligarc mal president estan puebl pie,-1
list 45 millon colombian apoy petr vam dej ningn lder cd afin v cas cualqui jug pong disposicin conoc profesional defend pas gent igual vam hac,0
ladronass,-1
mediocr 1000,-1
alivi asamble hab jal caden inodor excrement putrefact 2 aos ahor segu limpiez,0
qu diferent president per supuest corrupt prueb ecuador corrupt president destitu asamble pas derech quin entiend cnn pued explic,-1
preguntel si va hac candidat president proxim eleccin,0
seor lass mient macabr plan dic nic hiz jug lays ser destitu conocir siempr actu mentir mal fe derrumb actu mal fe,-1
total apoy sl president guillerm lass vuelv ms correaupt histori,1
plan macabr influj psiquic,-1