comentario,etiqueta
periodiquer ecu vis aviert lacay bachill evasor impuest ahor lder carondelet mafi narc poltic,-1
bast qu pauter est cad uds dic verd,-1
seor ecuavis uds entrevist gent pregunt si vien voluntari,-1
pen ver circ simpatiz gobiern oblig gobiern dir pen ver tan baj cad period ecuatorian cap espad quier defend indefend indefect,-1
rat,-1
hurt sucretiz deud millonari mahu lass feri bancari vuelv repet mitman debacl pas nunc ms favor,-1
hurt mahu river sant ordoez etcter ahor nunc ms gobiern cala,-1
largat,-1
esper asept candidatur quer bay pront si hor hech,-1
fin larg vay atu samborondon aye president barri riquill,-1
poc palabr mejor retir tiemp,0
va bolsill llen pt,0
deber pres,-1
mir realment presupuest alcald tod demand brutal obras qu requier restauracin quit dic quit ten cas blanc cas honor quit hermos contrari usted dio man tigr gran viviend qu usted siempr quier ms quit matorral pued dar favor buen presupuest logr ten quit hermos graci atencin,0
gran fall part ten cobard segund s acta bien capaz prxim eleccion presidencial pregunt suelt exist ms muert crcel qu piens usted aquell acontec muert cre qu moment invert pas ecuador segur rehabilitacin requier tres crcel grand mxim segur rehabilitacin requier gent expert segur rehabilitacin crcel segur vital reactivacin econm pas ecuador desastr natural sid atend qu pon man corazn inviert crcel pas tambin,0
ves est villavicenci yaku hervs oto va lass pandor,-1
lind nebot casi sant,1
excelent notici present eleccin pas vergenz trabaj dobl supong refier elimin evident dedic evad impuest blind banc fiscali investig,-1
va ped acect andat sombrit hascech dias asesinat pais cuent president,-1
ser ms fcil s compromet pas ms endeud naturalez divers consideracin oro pur vez regal isla galpag canj deud naturalez qu si nacion deudor compromet proteg recurs natural podr optar descuent deud ser ms san inteligent,0
usted cre qu manej slo obvi pas ecuador cuent riquez infinit biodivers biolgic consider patrimoni human joy incalcul ms grand mund jams regal preci gallin enferm usted equivoc usted privatiz hac canj deud naturalez recurs banc cambi deud primer consult pas ecuador negoci famili pued hac canj fond dued intern gobiern as acta 1984 amric latin atraves profund crisis deud antigu cientfic thom lovejoy fond naturalez wwf ahor conoc fond mundial naturalez escribi artcul the new york tim titul aid debtor nations ecology consider arig intelectual canj naturalez,0
pued cre qu hoy viv pas ecuador usted sali famos conferent clim cop26 glasgow sorpres anunci nuev rea marin proteg amp 60 000 kilmetr cuadr rededor islas galpag nuev amp ojo sto pondr lmit pesc industrial cre laboratori cientfic benefici mund obvi funcion medi canj deud naturalez pas ms endeud colombi argentin conveni divers biolgic cdb onu clasif ms biodivers mund posibl solucin endeud canj naturalez,0
pues tristez esmerald emergent usted dand notici fatal,-1
ndic tan baj aceptacin enclenqu impos gan,-1
excelent sr president guillerm lass,1
dos aos hic sol pag puntual deud bon qu due mism vergenz quier hac 6 mes hic 6 aos 4 junt moren 2 ahor,-1
n c s i t m s president bukel ecuador urgent,1
ms 10 aos busc ser president hac ms colg cuadr saln amarill vay cuid banc dej paz puebl despiert ecuador est merec respet dignid,0
equivoc qu rar veo llen 9 octubr 2014 sab quin lass si llev 30 aos poltic cre bigotn,-1
tard reconoc equivocacin sr nebot sab bien cul antecedent narc banquer sinembarg import suert puebl ecuatorian prefiri apoy indolent hoy m da viv carn propi hambr pobrez extrem,-1
psc despus banquer lass traicion sigu apoy lass debi hab sid destitu pandor papers villavicenci nebot salv banquer,-1
ahor s arrepient,0
lder socialcristian anda m4mad direct verdader orig desgraci est pas pas,-1
ah est sup lass,-1
quin sab qu oligarc corrupt quier gobiern derech delincuent abund nadi hac sol vuelt cinc 5,-1
much rason clas baj clas alta tanbi enga,0
tard quej port undam,-1
elpeorpresidentedelahistori lassoguillerm mashirafael,-1
social sirv deb hab ecuador part socialdemocrat exit capital explot protej derech trabaj exelent calid vid riquez,0
sr president favor atiendan docent siend explot quem tant activ program repetit gobiern correist favor escuch maestr quem total ayuden,0
dign ejempl honest esper turn arriesg seor president dios bendig,1
excelent president buen gestin,1
vacun favor toqu ir,0
quier quier congel preci combust quit subsidi ayud moren ahor est amenaz salg protest alto cost vid sub conbust histori repit cobr impuest banquer ric ecuador est jod,-1
favor ayud hospital abastezc medicin rueg graci,0
dios bendig sr president much sabidur,1
baj gasolin,0
envidi president junt president salvador dos grand ejempl latinoamr,1
dios bendig guard president famili dios quier nodotr humild don usted imigr venrzolan honrr glori dios0,1
gran ejempl caballer president my orgull pas,1
si quier mor defendert es problem buen desicion,1
pas nombr permit tenenci cos estn peor,0
segur organiz derech human van peg grit ciel pobrecit criminal pued ser afect onu oea organiz derech human tambi ver afectd igual criminal puebl ecuatorian luch junt criminal corbat cuell blanc terror criminal secuestr paz segur puebl,1
unid,1
gobiern capaz establec derech garantiz segur dej tare socied,-1
bien lass,1
excelent,1
delincuent falt segur llev ciudadan comun decent trabajasor extrem hac justici propi man ms convenient impotent viv tranquil l,1
pues tal vez solucion da oportun defendert tamp emparej accin da oportun defendert agravi,1
si quier mor defendert es problem buen desicion,1
clar s den permis pas prueb psicolg,0
clar s ayud ser as derech civil moral lgic defend t famili mism dud algun demcrat usa estn tir est posibil defens logr termin destruccin usa,1
siiii mism toc turn m par seman acord m edad hoy pregunt pes const padrn electoral x estudi espa dijeron da acord m edad vay vacur,0
futur ecuador usted est asegur,1
excelent trabaj,1
graci seor president gran trabaj,1
excelent,1
porfavor compr vacun casin chin mal da porcentaj baj respect eficient,0
bien hac loc estn gobiern desconoc ud president pas llam ecuador person reconoc guayaquil ecuador sold polic sublev guayaquil interes personal gobiern,0
quer ser venezuel ok,1
venezolan den vot lass,0
venezuel van elimin dlar contin dand vot lass,-1
gan carg president despu dos aos peor venezuel delincuent corrupcin,-1
vide envejec mal tip ecuador murindos hambr siend asesin reserv internacional ms altas histori,-1
mierd peor venezuel c r j o,-1
va hab aliment ser venezuel pais va miseri total,0
vot lass contrari futur ser venezuel,-1
lass qued,-1
deud 90 futur ser venezuel,0
parec correct contrari venezuel,-1
sol venezolan pued levant lass,0
lass dij 100 min prepar 10 aos quer ser venezuel 3 dorit despus coch bomb rcord asesinat secuestr cort cabez pon jug ftbol medicin vas pas pas ser mejor latam peor a l estudi univers inflacin apes ten dlar quer ser venezuel,-1
convert ecuador venezuel volvers hac,-1
desdolariz amig amig salv amig,0
agradezc guillerm lass salv la miseri si gan president yo sali pais,1
comentari aqu 4 aos habl pas vam miseri ojo dej comentari lik 4 aos habl,0
sr lass si compromis poblacin ecuatorian da oportun gabinet sep gobern intent imit mejor gobiern durn ball len febresc usted buen eleccin aos pas est hund endeud cambi ley pas corrupt compr diner fcil da vergenz ajen emigr segu envi divis famili qu sueld baj pes ten dlar los jubil mal viv mal vist nivel mundial qu fcil rob ley culp nadi ello ms habit pued cotiz volv llen arcas turism economi delant funcion bien ministeri acuerd compit product export pens vot maan si usted compromet gabinet va saqu consig 4 aos,0
arauz president,0
banquer ladron,-1
opcin social lass president,1
lass mas lenin moren saqueador pais si quier segu empobrec vot lass,-1
lass mejor opcin vot lass,1
gent aruaz corre,0
viv venezuel cre ley banquer mand mmillon ecuatorian exili miser,-1
maldit dlar ecuador prctic est mierd dlar llen ecuador corrupt narcotrf ladron avionet caen dlar cre moned ecuatorian valg ms maldit dlar van hac dlar banquer rob fcilment,0
vot bien ecuatorian hag patri limpi puebl social delincuent derech vien,0
si ecuador est venezuel graci lenin moren guillerm lass,-1
amric latin izquierd,0
milagr ecuatorian rafael corre lenin moren andres arauz todtit band pas ser pobr muert hambr poltic ms ric ecuador puebl sig pobr,0
vot usted sr lass,-1
viv arauz rabascal siempr rafael corre,0
mentir arauz va fortalec dolarizacin digam ud cre q famli va subsist 120 mes ahor si x q ven perd ofrec 500 sol cuent venezuel met mied gent vot x uds ologarc venezuel eeuu bloque econm pes tal bloque si aliment muer hambr adems presid3nt nicols madur da gratis puebl vacun cov tra rusi prens complic tod mentir favor investig dej enga nebot lass q mism igual yaku tip q da honest sac provech puebl,0
seri bolb fery bancari lass cabez quebr pais q import rat x fin puebl despertoooooooo,-1
ladron asso nunc sers president,-1
mentirs,-1
ladrn chulquer,-1
guillerm lass pesim andrs arauz colombi pib nominal pod milit uruguay pib per cpit puert ric calid vid,-1
lass habl bob si pais convert venezuel acuerd hac cojud jamil decret feri bancari dej sum pobrez millon ecuatorian cres puebl olvid tan terribl trajedi sinverguenz,-1
quier convert hait,0
vam lass president 2021,1
lass quier covert com colombi derech permit gobern izquierd progres,-1
strategi lass es unic pais que ciudadan pag energui agu internet es unic pais que ciudadan si atend adecu gobiern covi y mur pais ecuador es pais mas muert por congobern derech,-1
vid vist tant hipocres disqu ser human,-1
mentir carism gent carent recurs tcnic administr pas,-1
lass palabr bonit realid asco mentir vot val millon perdon vot ser poltic jov ide clar,-1
viv madur seu pov pov equador libr,0
arrib lass vam pued sent asamble engord bolsill,1
hor,0
tiemp sac carct fuert lass trist pas estn legisl pur corrupt,1
cuent es relat no ser escrit 4 pelagat ahor canal 10 tv,0
est prens pag sed eeuu estn tambin tras inters propi,0
mat cherrez,0
aplaus seor president,1
bien president guillerm lass,1
si president izquietd oea unid rasg vestidur dand golp,0
fueg comun quier tom pod tramp polit despu qued pod indefin fraud venezuel nicaragu descar cub si dig fueg todod terror,0
felic seor president laz,1
hiz estupidez algun tod lacr asamble bot sol titer prfug tranquil nuev asamble podr segu mayor mism part continu cicl unic maner termin president vencedor asamble mayori part,0
dictador,-1
guillerm laz cre emper nern incendi rom s irn lleg poltic m paiz,-1
est man mitoman cans ment,-1
inocent astronaut saturn jejej,-1
bien hech,1
individu maan dic cos noch dic as sid 2 aos bipol pued cre,0
mism pres pedr castill peru hac mism ser gran empresari gran millonari pedr castill indgen pregunt mas apoll unid bay bonit democraci oea comun internacional estan derech human pregunt mas,0
ningun lad entra dud si debi enjuci corrupcion lass esper ecuador suert vist tip armas,0
porqueri,-1
sr president lass habl verd dios salv ecuador futur,1
inteligent,0
buen novel ser ms corrupt,0
ahy ir corre i encarcel,0
peque dictador due casi medi comunicacin banc ecuatorian ms apoy eeuu consp gobiern rafael corre volunt poltic ciudadan formul tip acus judicializ poltic sac rued electoral president mas popul ecuador ahor soport presin puebl ahor suspendi tod garant constitucional adjudic poder,-1
vet cas dedcat banc que sab hac president dist pie bol,-1
dud tod s asegur cort constitucional nid correat si final eleg asamblest peor president veteran derech nic opcin despus valedor ojet nebot esper sig valient villavicenci posibl opcin dud ay ecuador tristez caray,0
ten super corre usted reconoc puebl cantalet produj etc tap incapac pobr patri,0
excelent decisin seor president bast dar com vag asamble,1
prueb,0
bien president mejor desicion asamblest vag delincuent vuelv ms,1
pobree,1
jajaj seor q habl si sirv pa sig echndol culp sab q mism meti grav gran problem q sup llev cab punt tem,-1
si per bolivi cnn estar dic golp noticier,0
absurd mas macabe ola impar insegur ciudadan gib delnsr lass pud manej combat rival poltic ningn protagon desastr social viv ecuador terror len febr corder extirp justificacin inoper seor lass president ecuador peor asesor sirv sirv nunc,-1
lament suced poltic macabr suci corrupt poltic integr slo gent tic,-1
cmo pas llen delincuent pobrez aun as gent cre ingenu cre period vend pag habl bien corrupt,-1
jajajaj si clar moment parec nio si jueg nadi ms jueg adult actu nios,-1
bien,1
president deber actu bukel nic president huev hierr,0
bn hech buitr quer convert ecuador brasil social ladron pag pr influenci poder sal,1
100 apoy president as gent ignor trat hac comprend ven ms all comn correism orig frut hoy,-1
falt pon realiz muert cruz evit juici polit ir carcel consecuent rededor 6 mes rob eleg pais asil polit persecutor quier ver carcel campant escap hic feri bancari tambi particip si much memori ladron lass hech tiemp pas ecuatorian pais general,-1
entonc deb convoc eleccion popular nuev asamble nacional,0
usted sig rob problem,-1
seor lass usted piens hiz fren regres corre jajajaj usted hiz abrir puert regres mas pront ver,0
v brav president guillerm lass bendicion,1
ahor sig muert cruz cne,0
narcobanquer salv traser,-1
abaj social,0
buen dios quier hech sr lass bien pas ecuador est ahor mism indefens ojal maldit depred siempr met car corromp sinvergenz nuev ah dios protej pas,0
result difcil cre todav ay ecuatorian an sig creyend ste farsant mentir lass peor gobiern ecuador as qued desd escrit histori ecuador,-1
juec sant histori,0
escuch irs da ris,-1
mientr cient polic militar cuid nio narc albans lass0 mant gran matanz muert her dentr funerari nios grit mam muer es horror terror moment polic militar cuid deb hac,0
muert cruz usad qu hombr maletn don cuc fracas compr asamblest gobiern corrupt co,-1
buen hech tod asamble compli destruccin patri est narc las desfalc pas asamble sueld siend eleg defend derech ley est nueb eleccion rpid las,-1
mentir,-1
qu enfrent valor acus si fals deb tem,0
dictadorzuel sab asamble iba echar cas ahor va hac deshac decret ley dios ampar,-1
van dar prend islas galpag cambi deud extern hablr,0
cierr embaj cub nicaragu venezuel,0
total apoy,1
ose da entend evadi crmen sol tambin fiscal poc palabr trabaj evit hic rafael fin apart particip nuev postul presidencial encim encarcel cab dud hombr pill mxim expresin,-1
felicit president lass fu mejor hiz ecuador,1
pedr castill quis hac mism pres queri perd privilegi,0
pud present prueb defend present document rectific hech corrupcin tan sol busc tiemp aclit dej pas,-1
dios protej president guillerm las,1
voy aplaud lass tampoc voy ser cieg asamble nunc iba reform ley estn favor delincuent crim organiz mism asamblest sab realid pas ahor quit resguard policial van ver carn propi sufr pas llor quit sueld 4000 dlar arrib ahor pan pedaz fin asamble nunc volv,0
dal burr trig hac corrupcin corre si jod pong denunci cort internacional acat dig ver si sig mism,-1
bien dich bien hech,1
sr super buc d l9cos,-1
extra plan siend desarroll venezuel,0
pas ina ina ina moren,0
ser esper desesper veo hor est tip vay,-1
las est desvari pobr hombr habl porquer acuerd perdi eleccion pus enferm pens gan feliz emocin lueg dieron notici perdi pus mal vez sali bien fraud acuerd averig jaj,-1
peor perfect crebl ex asamblest tant tramoy politiquer posibl,0
nefast corrupt president pud defend pecul 3 h uso 50 min deliri habl estabil pas siend contrari insegur desemple falt medicament hospital sicariat delincuent 3 millon nios desnutricin crnic 82 nios cncer muert falt medicin mientr regal incent dic banc guayaquil propied lass 2 300 000 mientr 10 mil millon suiz inviert bsic segur salud educacin,-1
pobr verg,-1
corrupt evasor renunci,-1
lass mantuv hern luqu deleg x decret viol constitucin manej emco pidi 150 mil 30 mil mensual cuad president danil carrer,0
macabr auw cherr sid asesin siend testig principal nadi dig nads,0
mejor pud hac viend narcocorr puest trab diner puebl asamble correist pod hac puebl prefiri hac show hac seguer correism mism empez chavist venezuel,1
lass sup corrupcin despidi johnny estupin x escrit hiz conoc corrupcin renovacin contrat 2022 flopec amazon tankers,0
quer hac igual per,0
lass debi ser destitu permit corrupcin empres denunci fiscal q obligacin funcionari razn destitucin pecul,-1
seor qued grand president hiz multimillonari hac par dcad mediant plan financier compr deud utiliz much lit pas apoder ahorr bancari ecuatorian provoc gran emigracind ciudadani lueg intent vari vec eleg fin logr anterior president moren fragu plan llev colaps pas hab logr repunt econm import baj ndic pobrez desnutricin delincuent analfabet aument pib export soberani factur petroler cost pon orden 15 aos moren lass logr destru 6 aos ndic aprobacin part ciudadan moren lass baj agreg enoj enriquec ilcit moren familiar cas ina papers negoci suci cuad lass,-1
derech golpist dis golp castill izquierd si acus golp hipocrit medi,0
crcel,-1
oligarc period president pen,0
acabevcon desemple ka criminal d delincuent d ahor si tambi macabr,0
carcel,-1
jajaj payas l mism habl corrupcin si ladrn nmer 1 ecuador libr juici poltic hiz,-1
cnn notici fals slo dic convien vend profund buen suert,0
pas est ms baj ayud ecuatorian q saqu riquez ac mism mism vend as pas va ms pabaj as president sirv pal pas,0
mafios cmo pud compr asamblest usa constitucin fuerz armad servici gring fin ten contrapod rob solit va decret,-1
preguntenl m 7 cherrez implic mayor cas corrupcion elimin habl ningun medi comum imparcial hech unic hech libr juici corrupcion maner qued impun,-1
muev radar destruccion radar mas trafic mas dolar mas lav banc lav dolar narc polit banquer dic evit plan macabr,-1
formate dej pas vuelv si quer ten pod elimin gent viej dig gent nuev correism rob mat iza tambi monton indi camp trat raz hoy estan polit mism,0
cnn pregntenl la muert cherr faggioni delegacin la ley ecuatorian hac respons design luqu lecar sab torpez,0
tristement garantiz retorn social sigl 21 ecuador grav error lass an si constitucin permit gan corre candidat siguient eleccin,0
pens pedr castill quiz hac mism mism razon termin pres quier pens lass pas banquer pedr si maestr quier pens lass va pas ali eeuu pedr si pas nort quier,0
notici deber ser ms fam youtub censur basurs,0
guillerm lass tembl mied juici respons congres sin inocent disuelv congres parec compromet monumental corrupcion saldr verdad,0
macabr,-1
pill evit bot qur delincuent evasor narc,-1
cuant dic presudent lass ds verd mism descubri ex asambl villavicenci pact corre nebot iza,1
sos in golpist zopenc,-1
pod lass control delincuent pas,0
lass autosuic 90 ecuatorian quer gobiern lass,-1
q buen,1
habl cualqui tonter ecuador nadi cre sol cuant sab corre hombr cap capacit gobern,-1
asamble mas tter corre qu hic lleg pod desestabiliz gobiern nic trabaj hic ahor pong trabaj rest puebl,0
dig hiz mism castill fuerz armad favor cre ao 2023 sig creyend poltic honest ser demasi ignor punt retras mental,0
uffff divert mayor golp disfraz ambos lad,0
jajaj asi llam ahor fcil dars cuent perd ten argument defiend destitucion inminent,-1
bien echo seor president puebl aplaud respet usted usted demostr realid ama puebl pod diner cmo usan tod manipul fin regres ms diner rob ade termin,1
seor est traum piens ase pued volv echo si yeg poder tomandocel ase ac har institucional puebl ws mand dentr mes rc psc pashakuty ganarn eleccion van cad gb ir siempr asta seor,-1
va pas gran padrin corrupcin empres piblic,0
salg vay cas sr,-1
sig elig progr,0
macabr plan ahor vez culp corre pngas bien pantalon acept pud gobern da cuent nadi quier pas est hart mentir tras ser lder estad mir sol interes econm famili quer vay sol usted hiz dao pas tod institu vyans cas dan cuent podredumbr dej da cuent xod qu pas insegur falt emple sal busc pas bienest pes pas siend tan ric sig siend pobr usted enriquec diner ecuatorian vyas cas descans gobern sirv,-1
brav,1
asambl vagamunderi,0
macabr plan ocho cuart usted represent ausent dbil actu poltic econm social peor antesesor moren inici deterior moral ustes complet sr las,-1
bien hech president lass hor,1
cnn valid golp,0
si president izquierd hac hac rat unid atac pas habl invad cmo president comun entonc pas,-1
asi mism ahor puebl oportun decid,0
ahor cuntan pelcul vaquer delincuent narcobanquer evasor,-1
simplement dictador,-1
cmo hic venezuel rob institucin institucin,0
cas gran padrin asesinat cherr fiscal dian salaz tambin gran respons lleb cab complet investigacin agent qu separ guillerm lass moment oportun darn declar gran misteri gran padrin asesinat gran amig cherr des gran padrin tenrr respond justici ecuatorian justici dibin,-1
mat testig cherr,0
fiscal narc,-1
pur perid borreg tarriner,0
juici poltic crcel pag,-1
"hab conoc hab hech implic,Neutro",-1
gent ecuador protest dic hac defil lgt mas 9 deoctubr sin aven atac orotest,-1
sr pas llen corrupt viv felic igual van debacl part gast campa pas pobr gast poltic plat paguens camp ten carg hac dic si si sol entran liban albanes colombian venezolan chilen vien ac cierr fronter averig cmo unid est apto est apto all dej pag banc as deber hac usted aqu ponvi pilat lav man dej aregl muert cruz cambi constitucin va dej freg ms pas usted arcas diner val puebl que hac ver delincuent hac cambi,-1
deb ir crcel par delincuent,-1
novel fin justici hac conoc musti puebl pag jubil sig mism,-1
caterv sinvergenz corrupt as llen boc dec hac investig gobi corrupt fiscal cmplic delincuent,-1
gobiern narcobanquer pag prepotent corruptel destru pas baos ros sangr violenci,-1
dos sab,0
segn fiscal madr teres corre quier mat vergenz,-1
ley pues dos complic tant fechori gobiern decr villavicenci tambi dia dij tip si sup las tambi sabi salaz iba sab siend fiscal general,-1
millon ecuatorian sab verd guillerm lass ali feri bancari cap estructur criminal destru patri junt cuad danil carrer cherr dian salaz fern villavicenci,-1
salud cordial imbabur dr francisc herrer arauz encant escuch est bien ayer hic depsit cuent,1
vergenz fin x final animal criminal,1
cherr sabi demaci fiscal perdon,0
asalt democraci viej malv juli ces trujill tom tod entidad malv prevalecer junt narc president lass,1
dud mediocr 10 20 puest ded corrupt engendr trujillat lassomoren,-1
pregntel corre 2010 gobiern corre meti albanec traj albanec di ecuador albanec ahor sum ecuador narcotrf corre retir ka bas mant entren salg cargament drog llev delincuent vent indescrimi de drog tabl consum dej ka juventud pir hoy perd vici vici mat rob prest sicariat tant delincuent tambin implant ka corrupcin tod institu ka asamble tan podr rat raton rater li hoy viv herenci corre,-1
sinvergenz,-1
fiscal investig deb ser destitu solap acahuet corrupcion delincuent,-1
autor competent qued comentari as qued ejempl poltic,-1
cabez quier excus,0
destitucin urgent cabez narcogobiern hund ms pas,-1
call vam,0
mal comienz mal termin seor fiscal est ocult corrupcin,0
lasist estpid carcel lass,-1
porqu delincuent contin carg tras rej despiert ecuador,-1
to do chantag presion polit president lass buen hombr,1
si cambi maner pens cambi mism gobern vien van da gan sol rob diner pertenec si deb bast gobern bast sol sal la call sin tom concienci vot,0
narc lasism canc ecuador,-1
pillovicenci bob vers carrill pandoris lady dian cartel deb ser primer encerr caden perpetu ms grand criminal permit imper gobiern narc militar polic judicial cne ms,-1
fiscal red medit fsic narcopandoris vayans eeuu embaj odi ecuador nacin destac diez aos demostr puebl busc desarroll educacin trabaj compromis segur honest honros si pued mil obras demostr lleg ten autoestim,0
fiscal corrupt alcahuet president deb pres fiscali precident,-1
qu hac nacin prens basur oligarc limpi ecuador pest sig trat ocult corrupcin gobiern prefer gobiern correist dic,-1
despu elig izquierd ignor,-1
dos estn tap corrupcin guillerm lass dian salaz ojal pront lleg gobiern ame pas gent exist verdader justici hac gran dao puebl gent slo interes bienest aunqu puebl muer hambr mat salud,-1
qu hic lass,0
dos deb ir carcel,-1
insult princes dian gal tod institu estn podr corrupcin mediocr,-1
deb ir prisin glas crcel prueb,0
recontr torc justici,0
protest gobiern corruptoy vag,-1
fiscal dian salaz tambin deber ser investig,0
asamble sac ladron asesin,-1
esper puebl ecuatorian call hor,0
gobiern banquer cloac pestilent alcahuet aplaud,-1
lass caden nacional amenaz tom med judicial medi digital pus descubiert,0
salud seor merec juici polit merec carcel asunt extrem seri atent segur pais cualqui cos pokit cos menor mas simpl presis pag pen injust ahor 10 20 siend fiscal pais maxim represent ley incumpk primer dicj ley merec buen tiempit guard tod zart corrupt sinverguez,-1
junt pod ms 3 dorit despus ms rob ecuador guay secuestr famili ahor rob si mat mat pos not buen eleccin,-1
as convenc jajaj,0
farsant,-1
hol docent desempl particip socioemple,0
qu gust fn logr,1
viv patri lind patri llam ecuador,0
dud siempr buen not des entrar univers ser usted nuev reform entrar univers jven des futur pas,0
dios mo pas piens bien d vot seor lass,1
vam guillee contig,1
si favor gan lass humild opinin ecuador dese gobiern enseri preocup ciudadan mas an pandemi lenin jug vid ten plan vacunacin habl corrupcin verd corresm quier regres quier rob ms piens mal opcin vot arauz jov apen empiez vid propuest arauz van hac bien pas verd compr vot encim corre supong acab diner quier rob ms dej crisis jven migr consegu com enseri ecuatorian piens bien vot lass va acab dictadur corresm realid robarr c lass mejor opcin rescat pas ciudadan sue vot lass ose piens ecuador necesit pag much deud ofrec 1000 dlar ten va dand person desconoc lass gan enseri puebl deb levant estn viend car estpid,1
vam ecuador ahor oportun cambi vot seor guillerm lass viv nuev president,1
lass president,1
